library/src/blas3/Tensile/Logic/asm_full/aquavanjaram/aquavanjaram_Cijk_Ailk_Bjlk_DB.yaml
- {MinimumRequiredVersion: 4.8.1}
- aquavanjaram
- gfx940
- [Device 0049]
    SolutionIndex: 0
    SolutionNameMin: Cijk_Ailk_Bjlk_DB_MT128x128x16_MI16x16x4x1_SN_AMAS0_DTVA0_GLS0_LRVW1_NTA1_NTB1_NTC3_NTD2_NEPBS8_NLCB1_SVW1_TT2_128_VW1_WG64_4_1_WGM42
    SolutionIndex: 1
    SolutionNameMin: Cijk_Ailk_Bjlk_DB_MT128x128x16_MI16x16x4x1_SN_AMAS0_DTVA0_GLS1_LRVW1_NTA1_NTB0_NTC2_NTD2_NEPBS8_NLCB2_SVW1_TT2_128_VW1_WG64_4_1_WGM30
    SolutionIndex: 2
    SolutionNameMin: Cijk_Ailk_Bjlk_DB_MT128x128x16_MI16x16x4x1_SN_AMAS0_DTVA0_GLS1_LRVW1_NTA0_NTB0_NTC2_NTD2_NEPBS8_NLCB2_SVW1_TT2_128_VW1_WG64_4_1_WGM18
    SolutionIndex: 3
    SolutionNameMin: Cijk_Ailk_Bjlk_DB_MT128x128x16_MI16x16x4x1_SN_AMAS0_DTVA0_GLS1_LRVW1_NTA0_NTB1_NTC3_NTD3_NEPBS8_NLCB1_SVW1_TT4_64_VW1_WG32_8_1_WGM18
    SolutionIndex: 4
    SolutionNameMin: Cijk_Ailk_Bjlk_DB_MT128x128x16_MI16x16x4x1_SN_AMAS0_DTVA0_GLS1_LRVW1_NTA0_NTB1_NTC2_NTD3_NEPBS8_NLCB2_SVW1_TT4_64_VW1_WG32_8_1_WGM18
    SolutionIndex: 5
    SolutionNameMin: Cijk_Ailk_Bjlk_DB_MT128x128x16_MI16x16x4x1_SN_AMAS0_DTVA0_GLS1_LRVW1_NTA0_NTB0_NTC2_NTD2_NEPBS8_NLCB2_SVW1_TT4_64_VW1_WG32_8_1_WGM24
    SolutionIndex: 6
    SolutionNameMin: Cijk_Ailk_Bjlk_DB_MT128x128x16_MI16x16x4x1_SN_AMAS0_DTVA0_GLS1_LRVW1_NTA0_NTB1_NTC2_NTD3_NEPBS8_NLCB2_SVW1_TT2_128_VW1_WG64_4_1_WGM36
    SolutionIndex: 7
    SolutionNameMin: Cijk_Ailk_Bjlk_DB_MT128x64x16_MI16x16x4x1_SN_1LDSB1_DTVA1_GLS0_NLCB1_PLR5_TT2_64_WG64_4_1_WGM18
    SolutionIndex: 8
    SolutionNameMin: Cijk_Ailk_Bjlk_DB_MT128x64x16_MI16x16x4x1_SN_1LDSB1_DTVA1_GLS0_NLCB1_PLR5_TT2_64_WG64_4_1_WGM12
    SolutionIndex: 9
    SolutionNameMin: Cijk_Ailk_Bjlk_DB_MT128x64x16_MI16x16x4x1_SN_1LDSB1_LRVW1_NEPBS2_NLCB2_PLR1_SU0_SUS0_TT2_64_WGM30
    SolutionIndex: 10
    SolutionNameMin: Cijk_Ailk_Bjlk_DB_MT128x64x16_MI16x16x4x1_SN_1LDSB1_LRVW1_NEPBS2_NLCB2_PLR1_SU0_SUS0_TT2_64_WGM42
    SolutionIndex: 11
    SolutionNameMin: Cijk_Ailk_Bjlk_DB_MT128x64x16_MI16x16x4x1_SN_1LDSB1_LRVW1_NEPBS2_NLCB1_PLR1_SU0_SUS0_TT2_64_WGM42
    SolutionIndex: 12
    SolutionNameMin: Cijk_Ailk_Bjlk_DB_MT128x128x16_MI16x16x4x1_SN_1LDSB0_LRVW2_NEPBS4_NLCB1_PLR5_SU0_SUS0_TT2_128_WGM30
    SolutionIndex: 13
    SolutionNameMin: Cijk_Ailk_Bjlk_DB_MT64x64x16_MI16x16x4x1_SN_1LDSB1_DTVA0_GLS1_NLCB2_PLR5_TT2_32_WG32_8_1_WGM30
    SolutionIndex: 14
    SolutionNameMin: Cijk_Ailk_Bjlk_DB_MT64x64x16_MI16x16x4x1_SN_1LDSB0_DTVA0_GLS0_NLCB2_PLR1_TT2_32_WG32_8_1_WGM30
    SolutionIndex: 15
    SolutionNameMin: Cijk_Ailk_Bjlk_DB_MT64x64x16_MI16x16x4x1_SN_1LDSB0_DTVA0_EPS0_NLCB2_PLR1_TT2_32_WG32_8_1_WGM30
    SolutionIndex: 16
    SolutionNameMin: Cijk_Ailk_Bjlk_DB_MT64x64x16_MI16x16x4x1_SN_1LDSB1_DTVA0_EPS0_NLCB1_PLR5_TT2_32_WG32_8_1_WGM30
    SolutionIndex: 17
    SolutionNameMin: Cijk_Ailk_Bjlk_DB_MT128x64x16_MI16x16x4x1_SN_1LDSB0_DTVA1_EPS1_NLCB1_PLR1_TT2_64_WG64_4_1_WGM30
    SolutionIndex: 18
    SolutionNameMin: Cijk_Ailk_Bjlk_DB_MT128x128x16_MI16x16x4x1_SN_
    SolutionIndex: 19
    SolutionNameMin: Cijk_Ailk_Bjlk_DB_MT128x128x16_MI16x16x4x1_SN_SUS256_WGM18
    SolutionIndex: 20
    SolutionNameMin: Cijk_Ailk_Bjlk_DB_MT128x128x16_MI16x16x4x1_SN_SUS256_WGM24
    SolutionIndex: 21
    SolutionNameMin: Cijk_Ailk_Bjlk_DB_MT128x128x16_MI16x16x4x1_SN_SUS512_WGM36
    SolutionIndex: 22
    SolutionNameMin: Cijk_Ailk_Bjlk_DB_MT128x128x16_MI16x16x4x1_SN_SUS256_WGM30
    SolutionIndex: 23
    SolutionNameMin: Cijk_Ailk_Bjlk_DB_MT128x128x16_MI16x16x4x1_SN_SUS256_WGM12
    SolutionIndex: 24
    SolutionNameMin: Cijk_Ailk_Bjlk_DB_MT128x128x16_MI16x16x4x1_SN_SUS512_WGM30
    SolutionIndex: 25
    SolutionNameMin: Cijk_Ailk_Bjlk_DB_MT128x128x16_MI16x16x4x1_SN_SUS256_WGM3
    SolutionIndex: 26
    SolutionNameMin: Cijk_Ailk_Bjlk_DB_MT128x128x16_MI16x16x4x1_SN_SUS256_WGM36
    SolutionIndex: 27
    SolutionNameMin: Cijk_Ailk_Bjlk_DB_MT128x128x16_MI16x16x4x1_SN_SUS512_WGM24
    SolutionIndex: 28
    SolutionNameMin: Cijk_Ailk_Bjlk_DB_MT128x128x16_MI16x16x4x1_SN_1LDSB1_PLR5_SU32_SUS512_WGM24
    SolutionIndex: 29
    SolutionNameMin: Cijk_Ailk_Bjlk_DB_MT128x128x16_MI16x16x4x1_SN_1LDSB1_PLR5_SU32_SUS512_WGM36
    SolutionIndex: 30
    SolutionNameMin: Cijk_Ailk_Bjlk_DB_MT128x128x16_MI16x16x4x1_SN_1LDSB1_PLR5_SU32_SUS256_WGM12
    SolutionIndex: 31
    SolutionNameMin: Cijk_Ailk_Bjlk_DB_MT128x128x16_MI16x16x4x1_SN_1LDSB1_PLR5_SU32_SUS256_WGM18
    SolutionIndex: 32
    SolutionNameMin: Cijk_Ailk_Bjlk_DB_MT128x128x16_MI16x16x4x1_SN_1LDSB1_PLR5_SU32_SUS512_WGM30
    SolutionIndex: 33
    SolutionNameMin: Cijk_Ailk_Bjlk_DB_MT128x128x16_MI16x16x4x1_SN_1LDSB1_PLR5_SU32_SUS512_WGM12
    SolutionIndex: 34
    SolutionNameMin: Cijk_Ailk_Bjlk_DB_MT128x128x16_MI16x16x4x1_SN_1LDSB1_PLR5_SU32_SUS256_WGM30
    SolutionIndex: 35
    SolutionNameMin: Cijk_Ailk_Bjlk_DB_MT128x128x16_MI16x16x4x1_SN_1LDSB1_PLR5_SU32_SUS512_WGM18
    SolutionIndex: 36
    SolutionNameMin: Cijk_Ailk_Bjlk_DB_MT128x128x16_MI16x16x4x1_SN_1LDSB0_PLR1_SU0_SUS0_WGM3
    SolutionIndex: 37
    SolutionNameMin: Cijk_Ailk_Bjlk_DB_MT128x128x16_MI16x16x4x1_SN_1LDSB0_PLR1_SU0_SUS0_WGM36
    SolutionIndex: 38
    SolutionNameMin: Cijk_Ailk_Bjlk_DB_MT128x128x16_MI16x16x4x1_SN_1LDSB0_PLR1_SU0_SUS0_WGM18
    SolutionIndex: 39
    SolutionNameMin: Cijk_Ailk_Bjlk_DB_MT128x128x16_MI16x16x4x1_SN_1LDSB0_PLR1_SU0_SUS0_WGM24
    SolutionIndex: 40
    SolutionNameMin: Cijk_Ailk_Bjlk_DB_MT128x128x16_MI16x16x4x1_SN_1LDSB0_PLR1_SU0_SUS0_WGM12
    SolutionIndex: 41
    SolutionNameMin: Cijk_Ailk_Bjlk_DB_MT128x128x16_MI16x16x4x1_SN_1LDSB0_PLR1_SU0_SUS0_WGM30
    SolutionIndex: 42
    SolutionNameMin: Cijk_Ailk_Bjlk_DB_MT128x128x16_MI16x16x4x1_SN_1LDSB0_PLR5_SU0_SUS0_WGM36
    SolutionIndex: 43
    SolutionNameMin: Cijk_Ailk_Bjlk_DB_MT128x128x16_MI16x16x4x1_SN_1LDSB0_PLR5_SU0_SUS0_WGM12
    SolutionIndex: 44
    SolutionNameMin: Cijk_Ailk_Bjlk_DB_MT128x128x16_MI16x16x4x1_SN_1LDSB0_PLR5_SU0_SUS0_WGM24
    SolutionIndex: 45
    SolutionNameMin: Cijk_Ailk_Bjlk_DB_MT128x128x16_MI16x16x4x1_SN_1LDSB1_PLR5_SU0_SUS0_WGM12
    SolutionIndex: 46
    SolutionNameMin: Cijk_Ailk_Bjlk_DB_MT128x128x16_MI16x16x4x1_SN_1LDSB0_PLR5_SU0_SUS0_WGM18
    SolutionIndex: 47
    SolutionNameMin: Cijk_Ailk_Bjlk_DB_MT128x128x16_MI16x16x4x1_SN_1LDSB1_PLR5_SU0_SUS0_WGM24
    SolutionIndex: 48
    SolutionNameMin: Cijk_Ailk_Bjlk_DB_MT128x128x16_MI16x16x4x1_SN_1LDSB1_PLR5_SU0_SUS0_WGM36
    SolutionIndex: 49
    SolutionNameMin: Cijk_Ailk_Bjlk_DB_MT128x128x16_MI16x16x4x1_SN_1LDSB1_PLR5_SU0_SUS0_WGM30
    SolutionIndex: 50
    SolutionNameMin: Cijk_Ailk_Bjlk_DB_MT128x128x16_MI16x16x4x1_SN_1LDSB1_AMAS3_GRVW2_GLS0_NEPBS4_NLCA1_NLCB1_PLR1_SU0_SUS0_SVW2_TT2_128_VW2_WGM2
    SolutionIndex: 51
    SolutionNameMin: Cijk_Ailk_Bjlk_DB_MT128x128x16_MI16x16x4x1_SN_1LDSB1_AMAS3_GRVW2_GLS1_NEPBS4_NLCA1_NLCB1_PLR5_SU32_SUS256_SVW2_TT2_128_VW2_WGM2
    SolutionIndex: 52
    SolutionNameMin: Cijk_Ailk_Bjlk_DB_MT128x128x16_MI16x16x4x1_SN_1LDSB1_AMAS3_GRVW2_GLS0_NEPBS2_NLCA1_NLCB1_PLR1_SU32_SUS256_SVW2_TT2_128_VW2_WGM2
    SolutionIndex: 53
    SolutionNameMin: Cijk_Ailk_Bjlk_DB_MT128x128x16_MI16x16x4x1_SN_1LDSB1_AMAS3_GRVW2_GLS0_NEPBS4_NLCA1_NLCB1_PLR5_SU32_SUS256_SVW2_TT2_128_VW2_WGM2
    SolutionIndex: 54
    SolutionNameMin: Cijk_Ailk_Bjlk_DB_MT128x128x16_MI16x16x4x1_SN_1LDSB1_AMAS3_GRVW2_GLS0_NEPBS4_NLCA1_NLCB1_PLR1_SU4_SUS256_SVW2_TT2_128_VW2_WGM2
    SolutionIndex: 55
    SolutionNameMin: Cijk_Ailk_Bjlk_DB_MT128x128x16_MI16x16x4x1_SN_1LDSB1_AMAS3_GRVW2_GLS1_NEPBS2_NLCA1_NLCB1_PLR1_SU0_SUS0_SVW2_TT2_128_VW2_WGM1
    SolutionIndex: 56
    SolutionNameMin: Cijk_Ailk_Bjlk_DB_MT128x128x16_MI16x16x4x1_SN_1LDSB1_AMAS3_GRVW2_GLS0_NEPBS4_NLCA1_NLCB1_PLR5_SU0_SUS0_SVW2_TT2_128_VW2_WGM2
    SolutionIndex: 57
    SolutionNameMin: Cijk_Ailk_Bjlk_DB_MT128x128x16_MI16x16x4x1_SN_1LDSB1_AMAS3_GRVW2_GLS0_NEPBS2_NLCA1_NLCB1_PLR1_SU0_SUS0_SVW2_TT2_128_VW2_WGM0
    SolutionIndex: 58
    SolutionNameMin: Cijk_Ailk_Bjlk_DB_MT128x128x16_MI16x16x4x1_SN_1LDSB1_AMAS3_GRVW2_GLS1_NEPBS2_NLCA1_NLCB1_PLR5_SU32_SUS256_SVW2_TT2_128_VW2_WGM2
    SolutionIndex: 59
    SolutionNameMin: Cijk_Ailk_Bjlk_DB_MT128x128x16_MI16x16x4x1_SN_1LDSB1_AMAS3_GRVW2_GLS0_NEPBS2_NLCA1_NLCB1_PLR1_SU4_SUS256_SVW2_TT2_128_VW2_WGM2
    SolutionIndex: 60
    SolutionNameMin: Cijk_Ailk_Bjlk_DB_MT128x128x16_MI16x16x4x1_SN_1LDSB1_AMAS3_GRVW2_GLS0_NEPBS4_NLCA1_NLCB1_PLR5_SU0_SUS0_SVW2_TT2_128_VW2_WGM1
    SolutionIndex: 61
    SolutionNameMin: Cijk_Ailk_Bjlk_DB_MT128x128x16_MI16x16x4x1_SN_1LDSB1_AMAS3_GRVW2_GLS0_NEPBS4_NLCA1_NLCB1_PLR5_SU4_SUS256_SVW2_TT2_128_VW2_WGM1
    SolutionIndex: 62
    SolutionNameMin: Cijk_Ailk_Bjlk_DB_MT128x128x16_MI16x16x4x1_SN_1LDSB1_AMAS3_GRVW2_GLS0_NEPBS2_NLCA1_NLCB1_PLR1_SU0_SUS0_SVW2_TT2_128_VW2_WGM1
    SolutionIndex: 63
    SolutionNameMin: Cijk_Ailk_Bjlk_DB_MT128x128x16_MI16x16x4x1_SN_1LDSB0_AMAS3_GRVW2_GLS1_NEPBS4_NLCA1_NLCB1_PLR1_SU32_SUS256_SVW2_TT2_128_VW2_WGM0
    SolutionIndex: 64
    SolutionNameMin: Cijk_Ailk_Bjlk_DB_MT128x128x16_MI16x16x4x1_SN_1LDSB1_AMAS3_GRVW2_GLS0_NEPBS4_NLCA1_NLCB1_PLR1_SU4_SUS256_SVW2_TT2_128_VW2_WGM0
    SolutionIndex: 65
    SolutionNameMin: Cijk_Ailk_Bjlk_DB_MT128x128x16_MI16x16x4x1_SN_1LDSB0_AMAS3_GRVW2_GLS0_NEPBS4_NLCA1_NLCB1_PLR1_SU4_SUS256_SVW2_TT2_128_VW2_WGM1
    SolutionIndex: 66
    SolutionNameMin: Cijk_Ailk_Bjlk_DB_MT128x128x16_MI16x16x4x1_SN_1LDSB0_AMAS3_GRVW2_GLS0_NEPBS4_NLCA1_NLCB1_PLR1_SU0_SUS0_SVW2_TT2_128_VW2_WGM1
    SolutionIndex: 67
    SolutionNameMin: Cijk_Ailk_Bjlk_DB_MT128x128x16_MI16x16x4x1_SN_1LDSB1_AMAS3_GRVW2_GLS1_NEPBS2_NLCA1_NLCB1_PLR5_SU0_SUS0_SVW2_TT2_128_VW2_WGM2
    SolutionIndex: 68
    SolutionNameMin: Cijk_Ailk_Bjlk_DB_MT128x128x16_MI16x16x4x1_SN_1LDSB0_AMAS3_GRVW2_GLS0_NEPBS4_NLCA1_NLCB1_PLR1_SU0_SUS0_SVW2_TT2_128_VW2_WGM5
    SolutionIndex: 69
    SolutionNameMin: Cijk_Ailk_Bjlk_DB_MT128x128x16_MI16x16x4x1_SN_1LDSB0_AMAS3_GRVW2_GLS0_NEPBS4_NLCA1_NLCB1_PLR1_SU0_SUS0_SVW2_TT2_128_VW2_WGM3
    SolutionIndex: 70
    SolutionNameMin: Cijk_Ailk_Bjlk_DB_MT128x128x16_MI16x16x4x1_SN_1LDSB1_AMAS3_GRVW2_GLS0_NEPBS4_NLCA1_NLCB1_PLR1_SU0_SUS0_SVW2_TT2_128_VW2_WGM1
    SolutionIndex: 71
    SolutionNameMin: Cijk_Ailk_Bjlk_DB_MT128x128x16_MI16x16x4x1_SN_1LDSB0_AMAS3_GRVW2_GLS0_NEPBS4_NLCA1_NLCB1_PLR5_SU0_SUS0_SVW2_TT2_128_VW2_WGM8
    SolutionIndex: 72
    SolutionNameMin: Cijk_Ailk_Bjlk_DB_MT128x128x16_MI16x16x4x1_SN_1LDSB0_AMAS3_GRVW2_GLS1_NEPBS4_NLCA1_NLCB1_PLR1_SU4_SUS256_SVW2_TT2_128_VW2_WGM3
    SolutionIndex: 73
    SolutionNameMin: Cijk_Ailk_Bjlk_DB_MT128x64x16_MI16x16x4x1_SN_1LDSB1_AMAS3_GRVW2_GLS0_NEPBS4_NLCA1_NLCB1_PLR1_SU0_SUS0_SVW2_TT2_64_VW2_WGM1
    SolutionIndex: 74
    SolutionNameMin: Cijk_Ailk_Bjlk_DB_MT128x96x16_MI16x16x4x1_SN_1LDSB1_AMAS0_GRVW1_GLS0_NEPBS4_NLCA2_NLCB3_PLR5_SU0_SUS0_SVW1_TT2_96_VW1_WGM3
    SolutionIndex: 75
    SolutionNameMin: Cijk_Ailk_Bjlk_DB_MT128x64x16_MI16x16x4x1_SN_1LDSB0_AMAS3_GRVW2_GLS0_NEPBS2_NLCA1_NLCB1_PLR5_SU4_SUS256_SVW2_TT2_64_VW2_WGM0
    SolutionIndex: 76
    SolutionNameMin: Cijk_Ailk_Bjlk_DB_MT128x64x16_MI16x16x4x1_SN_1LDSB0_AMAS3_GRVW2_GLS0_NEPBS4_NLCA1_NLCB1_PLR1_SU0_SUS0_SVW2_TT2_64_VW2_WGM3
    SolutionIndex: 77
    SolutionNameMin: Cijk_Ailk_Bjlk_DB_MT128x128x8_MI16x16x4x1_SN_1LDSB0_AMAS3_DTVA0_GRVW2_GLS0_NEPBS4_NLCA1_NLCB1_PLR3_SU0_SUS0_SVW2_TT2_128_VW2_WG64_4_1_WGM2
    SolutionIndex: 78
    SolutionNameMin: Cijk_Ailk_Bjlk_DB_MT128x96x16_MI16x16x4x1_SN_1LDSB1_AMAS3_DTVA0_GRVW2_GLS0_NEPBS2_NLCA1_NLCB3_PLR5_SU32_SUS256_SVW2_TT2_96_VW2_WG64_4_1_WGM18
    SolutionIndex: 79
    SolutionNameMin: Cijk_Ailk_Bjlk_DB_MT128x128x8_MI16x16x4x1_SN_1LDSB0_AMAS3_DTVA0_GRVW2_GLS0_NEPBS4_NLCA1_NLCB2_PLR3_SU0_SUS0_SVW2_TT2_128_VW2_WG64_4_1_WGM2
    SolutionIndex: 80
    SolutionNameMin: Cijk_Ailk_Bjlk_DB_MT128x128x16_MI16x16x4x1_SN_1LDSB1_AMAS3_DTVA1_GRVW2_GLS1_NEPBS4_NLCA1_NLCB1_PLR5_SU0_SUS0_SVW2_TT2_128_VW2_WG64_4_1_WGM18
    SolutionIndex: 81
    SolutionNameMin: Cijk_Ailk_Bjlk_DB_MT128x96x16_MI16x16x4x1_SN_1LDSB1_AMAS3_DTVA1_GRVW2_GLS1_NEPBS2_NLCA1_NLCB3_PLR5_SU32_SUS256_SVW2_TT2_96_VW2_WG64_4_1_WGM18
    SolutionIndex: 82
    SolutionNameMin: Cijk_Ailk_Bjlk_DB_MT128x128x8_MI16x16x4x1_SN_1LDSB1_AMAS3_DTVA0_GRVW2_GLS0_NEPBS4_NLCA1_NLCB1_PLR1_SU0_SUS0_SVW2_TT2_128_VW2_WG64_4_1_WGM2
    SolutionIndex: 83
    SolutionNameMin: Cijk_Ailk_Bjlk_DB_MT128x96x16_MI16x16x4x1_SN_1LDSB1_AMAS3_DTVA1_GRVW2_GLS1_NEPBS2_NLCA1_NLCB3_PLR5_SU32_SUS256_SVW2_TT2_96_VW2_WG64_4_1_WGM2
    SolutionIndex: 84
    SolutionNameMin: Cijk_Ailk_Bjlk_DB_MT128x64x16_MI16x16x4x1_SN_1LDSB0_AMAS3_DTVA1_GRVW2_GLS0_NEPBS2_NLCA1_NLCB1_PLR1_SU0_SUS0_SVW2_TT2_64_VW2_WG64_4_1_WGM2
    SolutionIndex: 85
    SolutionNameMin: Cijk_Ailk_Bjlk_DB_MT128x96x16_MI16x16x4x1_SN_1LDSB1_AMAS3_DTVA1_GRVW2_GLS1_NEPBS2_NLCA1_NLCB3_PLR5_SU0_SUS0_SVW2_TT2_96_VW2_WG64_4_1_WGM2
    SolutionIndex: 86
    SolutionNameMin: Cijk_Ailk_Bjlk_DB_MT128x96x16_MI16x16x4x1_SN_1LDSB1_AMAS3_DTVA1_GRVW2_GLS1_NEPBS2_NLCA1_NLCB3_PLR5_SU0_SUS0_SVW2_TT2_96_VW2_WG64_4_1_WGM18
    SolutionIndex: 87
    SolutionNameMin: Cijk_Ailk_Bjlk_DB_MT128x64x16_MI16x16x4x1_SN_1LDSB0_AMAS3_DTVA1_GRVW2_GLS0_NEPBS4_NLCA1_NLCB2_PLR1_SU0_SUS0_SVW2_TT2_64_VW2_WG64_4_1_WGM3
    SolutionIndex: 88
    SolutionNameMin: Cijk_Ailk_Bjlk_DB_MT96x64x16_MI16x16x4x1_SN_1LDSB1_AMAS0_DTVA0_GRVW1_GLS0_NEPBS0_NLCA3_NLCB1_PLR5_SU0_SUS0_SVW1_TT3_32_VW1_WG32_8_1_WGM2
    SolutionIndex: 89
    SolutionNameMin: Cijk_Ailk_Bjlk_DB_MT128x96x16_MI16x16x4x1_SN_1LDSB1_AMAS3_DTVA1_GRVW2_GLS1_NEPBS2_NLCA1_NLCB3_PLR5_SU0_SUS0_SVW2_TT2_96_VW2_WG64_4_1_WGM3
    SolutionIndex: 90
    SolutionNameMin: Cijk_Ailk_Bjlk_DB_MT128x128x16_MI16x16x4x1_SN_1LDSB1_AMAS3_DTVA1_GRVW2_GLS1_NEPBS4_NLCA1_NLCB2_PLR5_SU0_SUS0_SVW2_TT2_128_VW2_WG64_4_1_WGM18
    SolutionIndex: 91
    SolutionNameMin: Cijk_Ailk_Bjlk_DB_MT128x96x16_MI16x16x4x1_SN_1LDSB0_AMAS3_DTVA1_GRVW2_GLS0_NEPBS4_NLCA1_NLCB3_PLR5_SU0_SUS0_SVW2_TT2_96_VW2_WG64_4_1_WGM4
    SolutionIndex: 92
    SolutionNameMin: Cijk_Ailk_Bjlk_DB_MT128x96x16_MI16x16x4x1_SN_1LDSB1_AMAS3_DTVA1_GRVW2_GLS0_NEPBS4_NLCA1_NLCB3_PLR5_SU0_SUS0_SVW2_TT2_96_VW2_WG64_4_1_WGM2
    SolutionIndex: 93
    SolutionNameMin: Cijk_Ailk_Bjlk_DB_MT128x64x8_MI16x16x4x1_SN_1LDSB1_AMAS3_DTVA0_GRVW2_GLS0_NEPBS2_NLCA1_NLCB1_PLR1_SU0_SUS0_SVW2_TT2_64_VW2_WG64_4_1_WGM18
    SolutionIndex: 94
    SolutionNameMin: Cijk_Ailk_Bjlk_DB_MT128x96x16_MI16x16x4x1_SN_1LDSB1_AMAS3_DTVA1_GRVW2_GLS0_NEPBS4_NLCA1_NLCB3_PLR5_SU0_SUS0_SVW2_TT2_96_VW2_WG64_4_1_WGM4
    SolutionIndex: 95
    SolutionNameMin: Cijk_Ailk_Bjlk_DB_MT128x128x16_MI16x16x4x1_SN_1LDSB0_AMAS3_DTVA1_GRVW2_GLS0_NEPBS4_NLCA1_NLCB1_PLR1_SU32_SUS256_SVW2_TT2_128_VW2_WG64_4_1_WGM3
    SolutionIndex: 96
    SolutionNameMin: Cijk_Ailk_Bjlk_DB_MT128x128x8_MI16x16x4x1_SN_1LDSB1_AMAS3_DTVA0_GRVW2_GLS0_NEPBS4_NLCA1_NLCB2_PLR1_SU32_SUS256_SVW2_TT2_128_VW2_WG64_4_1_WGM18
    SolutionIndex: 97
    SolutionNameMin: Cijk_Ailk_Bjlk_DB_MT128x128x16_MI16x16x4x1_SN_1LDSB0_AMAS3_DTVA1_GRVW2_GLS0_NEPBS0_NLCA1_NLCB1_PLR5_SU0_SUS0_SVW2_TT2_128_VW2_WG64_4_1_WGM2
    SolutionIndex: 98
    SolutionNameMin: Cijk_Ailk_Bjlk_DB_MT128x128x16_MI16x16x4x1_SN_1LDSB1_AMAS3_DTVA1_GRVW2_GLS1_NEPBS4_NLCA1_NLCB1_PLR5_SU0_SUS0_SVW2_TT2_128_VW2_WG64_4_1_WGM3
    SolutionIndex: 99
    SolutionNameMin: Cijk_Ailk_Bjlk_DB_MT128x96x16_MI16x16x4x1_SN_1LDSB1_AMAS3_DTVA1_GRVW2_GLS0_NEPBS2_NLCA1_NLCB3_PLR5_SU0_SUS0_SVW2_TT2_96_VW2_WG64_4_1_WGM18
    SolutionIndex: 100
    SolutionNameMin: Cijk_Ailk_Bjlk_DB_MT128x64x16_MI16x16x4x1_SN_1LDSB0_AMAS3_DTVA1_GRVW2_GLS0_NEPBS4_NLCA1_NLCB1_PLR5_SU0_SUS0_SVW2_TT2_64_VW2_WG64_4_1_WGM2
    SolutionIndex: 101
    SolutionNameMin: Cijk_Ailk_Bjlk_DB_MT128x64x16_MI16x16x4x1_SN_1LDSB0_AMAS3_DTVA1_GRVW2_GLS0_NEPBS4_NLCA1_NLCB1_PLR5_SU0_SUS0_SVW2_TT2_64_VW2_WG64_4_1_WGM4
    SolutionIndex: 102
    SolutionNameMin: Cijk_Ailk_Bjlk_DB_MT128x64x16_MI16x16x4x1_SN_1LDSB1_AMAS3_DTVA1_GRVW2_GLS0_NEPBS2_NLCA1_NLCB2_PLR5_SU0_SUS0_SVW2_TT2_64_VW2_WG64_4_1_WGM2
    SolutionIndex: 103
    SolutionNameMin: Cijk_Ailk_Bjlk_DB_MT128x64x16_MI16x16x4x1_SN_1LDSB0_AMAS3_DTVA1_GRVW2_GLS0_NEPBS4_NLCA1_NLCB2_PLR1_SU0_SUS0_SVW2_TT2_64_VW2_WG64_4_1_WGM2
    SolutionIndex: 104
    SolutionNameMin: Cijk_Ailk_Bjlk_DB_MT96x64x16_MI16x16x4x1_SN_1LDSB1_AMAS0_DTVA0_GRVW1_GLS0_NEPBS4_NLCA3_NLCB2_PLR5_SU0_SUS0_SVW1_TT3_32_VW1_WG32_8_1_WGM2
    SolutionIndex: 105
    SolutionNameMin: Cijk_Ailk_Bjlk_DB_MT96x64x16_MI16x16x4x1_SN_1LDSB0_AMAS0_DTVA0_GRVW1_GLS0_NEPBS0_NLCA3_NLCB1_PLR1_SU0_SUS0_SVW1_TT3_32_VW1_WG32_8_1_WGM2
    SolutionIndex: 106
    SolutionNameMin: Cijk_Ailk_Bjlk_DB_MT128x96x16_MI16x16x4x1_SN_1LDSB1_AMAS3_DTVA1_GRVW2_GLS0_NEPBS4_NLCA1_NLCB3_PLR5_SU32_SUS256_SVW2_TT2_96_VW2_WG64_4_1_WGM3
    SolutionIndex: 107
    SolutionNameMin: Cijk_Ailk_Bjlk_DB_MT128x96x16_MI16x16x4x1_SN_1LDSB1_AMAS3_DTVA1_GRVW2_GLS0_NEPBS4_NLCA1_NLCB3_PLR5_SU0_SUS0_SVW2_TT2_96_VW2_WG64_4_1_WGM3
    SolutionIndex: 108
    SolutionNameMin: Cijk_Ailk_Bjlk_DB_MT128x96x16_MI16x16x4x1_SN_1LDSB1_AMAS3_DTVA1_GRVW2_GLS1_NEPBS0_NLCA1_NLCB3_PLR5_SU0_SUS0_SVW2_TT2_96_VW2_WG64_4_1_WGM4
    SolutionIndex: 109
    SolutionNameMin: Cijk_Ailk_Bjlk_DB_MT96x64x16_MI16x16x4x1_SN_1LDSB0_AMAS0_DTVA0_GRVW1_GLS0_NEPBS0_NLCA3_NLCB2_PLR1_SU0_SUS0_SVW1_TT3_32_VW1_WG32_8_1_WGM3
    SolutionIndex: 110
    SolutionNameMin: Cijk_Ailk_Bjlk_DB_MT64x64x16_MI16x16x4x1_SN_1LDSB0_AMAS0_DTVA1_GRVW1_GLS1_NEPBS0_NLCA1_NLCB1_PLR1_SU0_SUS0_SVW1_TT1_64_VW1_WG64_4_1_WGM18
    SolutionIndex: 111
    SolutionNameMin: Cijk_Ailk_Bjlk_DB_MT128x64x16_MI16x16x4x1_SN_1LDSB0_AMAS3_DTVA1_GRVW2_GLS0_NEPBS4_NLCA1_NLCB2_PLR5_SU0_SUS0_SVW2_TT2_64_VW2_WG64_4_1_WGM3
    SolutionIndex: 112
    SolutionNameMin: Cijk_Ailk_Bjlk_DB_MT64x64x16_MI16x16x4x1_SN_1LDSB0_AMAS0_DTVA1_GRVW1_GLS0_NEPBS0_NLCA1_NLCB1_PLR1_SU32_SUS256_SVW1_TT1_64_VW1_WG64_4_1_WGM2
    SolutionIndex: 113
    SolutionNameMin: Cijk_Ailk_Bjlk_DB_MT64x64x16_MI16x16x4x1_SN_1LDSB0_AMAS0_DTVA1_GRVW1_GLS0_NEPBS0_NLCA1_NLCB2_PLR1_SU32_SUS256_SVW1_TT1_64_VW1_WG64_4_1_WGM4
    SolutionIndex: 114
    SolutionNameMin: Cijk_Ailk_Bjlk_DB_MT64x64x16_MI16x16x4x1_SN_1LDSB0_AMAS0_DTVA1_GRVW1_GLS0_NEPBS0_NLCA1_NLCB1_PLR5_SU32_SUS256_SVW1_TT1_64_VW1_WG64_4_1_WGM3
    SolutionIndex: 115
    SolutionNameMin: Cijk_Ailk_Bjlk_DB_MT64x64x16_MI16x16x4x1_SN_1LDSB0_AMAS0_DTVA1_GRVW1_GLS0_NEPBS0_NLCA1_NLCB1_PLR1_SU0_SUS0_SVW1_TT1_64_VW1_WG64_4_1_WGM3
    SolutionIndex: 116
    SolutionNameMin: Cijk_Ailk_Bjlk_DB_MT32x16x16_MI16x16x4x1_SN_GRVW2_GLS1_PLR1_TT2_16_WG16_4_4_WGM1
    SolutionIndex: 117
    SolutionNameMin: Cijk_Ailk_Bjlk_DB_MT64x16x16_MI16x16x4x1_SN_GRVW1_GLS1_PLR1_TT1_16_WG64_4_1_WGM2
    SolutionIndex: 118
    SolutionNameMin: Cijk_Ailk_Bjlk_DB_MT16x16x64_MI16x16x4x1_SN_GRVW1_GLS1_PLR5_TT1_16_WG16_4_4_WGM2
    SolutionIndex: 119
    SolutionNameMin: Cijk_Ailk_Bjlk_DB_MT64x32x16_MI16x16x4x1_SN_1LDSB0_AMAS0_DTVA1_GRVW1_NEPBS4_NLCA1_PLR5_SVW1_TT1_32_VW1_WG64_4_1_WGM12
    SolutionIndex: 120
    SolutionNameMin: Cijk_Ailk_Bjlk_DB_MT32x64x32_MI16x16x4x1_SN_1LDSB1_AMAS0_DTVA0_GRVW1_NEPBS0_NLCA1_PLR9_SVW1_TT1_32_VW1_WG32_8_1_WGM6
    SolutionIndex: 121
    SolutionNameMin: Cijk_Ailk_Bjlk_DB_MT64x32x16_MI16x16x4x1_SN_1LDSB0_AMAS0_DTVA1_GRVW1_NEPBS4_NLCA1_PLR1_SVW1_TT1_32_VW1_WG64_4_1_WGM12
    SolutionIndex: 122
    SolutionNameMin: Cijk_Ailk_Bjlk_DB_MT64x64x16_MI16x16x4x1_SN_1LDSB1_AMAS0_DTVA1_GRVW1_NEPBS0_NLCA1_PLR5_SVW1_TT1_64_VW1_WG64_4_1_WGM6
    SolutionIndex: 123
    SolutionNameMin: Cijk_Ailk_Bjlk_DB_MT64x64x32_MI16x16x4x1_SN_1LDSB1_AMAS0_DTVA1_GRVW1_NEPBS0_NLCA1_PLR9_SVW1_TT1_64_VW1_WG64_4_1_WGM6
    SolutionIndex: 124
    SolutionNameMin: Cijk_Ailk_Bjlk_DB_MT64x64x16_MI16x16x4x1_SN_1LDSB1_AMAS0_DTVA0_GRVW1_NEPBS0_NLCA1_PLR5_SVW1_TT2_32_VW1_WG32_8_1_WGM12
    SolutionIndex: 125
    SolutionNameMin: Cijk_Ailk_Bjlk_DB_MT64x64x16_MI16x16x4x1_SN_1LDSB0_AMAS0_DTVA1_GRVW1_NEPBS0_NLCA1_PLR1_SVW1_TT1_64_VW1_WG64_4_1_WGM6
    SolutionIndex: 126
    SolutionNameMin: Cijk_Ailk_Bjlk_DB_MT64x64x16_MI16x16x4x1_SN_1LDSB1_AMAS3_DTVA0_GRVW2_NEPBS0_NLCA1_PLR5_SVW2_TT2_32_VW2_WG32_8_1_WGM12
    SolutionIndex: 127
    SolutionNameMin: Cijk_Ailk_Bjlk_DB_MT128x64x16_MI16x16x4x1_SN_1LDSB1_AMAS0_DTVA0_GRVW2_NEPBS0_NLCA1_PLR5_SVW1_TT4_32_VW1_WG32_8_1_WGM12
    SolutionIndex: 128
    SolutionNameMin: Cijk_Ailk_Bjlk_DB_MT128x64x16_MI16x16x4x1_SN_1LDSB1_AMAS0_DTVA0_GRVW2_NEPBS0_NLCA1_PLR1_SVW1_TT4_32_VW1_WG32_8_1_WGM6
    SolutionIndex: 129
    SolutionNameMin: Cijk_Ailk_Bjlk_DB_MT128x64x16_MI16x16x4x1_SN_1LDSB0_AMAS0_DTVA0_GRVW1_NEPBS0_NLCA1_PLR5_SVW1_TT4_32_VW1_WG32_8_1_WGM6
    SolutionIndex: 130
    SolutionNameMin: Cijk_Ailk_Bjlk_DB_MT128x64x16_MI16x16x4x1_SN_1LDSB1_AMAS0_DTVA0_GRVW1_NEPBS0_NLCA1_PLR5_SVW1_TT2_64_VW1_WG64_4_1_WGM12
    SolutionIndex: 131
    SolutionNameMin: Cijk_Ailk_Bjlk_DB_MT128x64x16_MI16x16x4x1_SN_1LDSB0_AMAS0_DTVA0_GRVW1_NEPBS0_NLCA1_PLR1_SVW1_TT2_64_VW1_WG64_4_1_WGM12
    SolutionIndex: 132
    SolutionNameMin: Cijk_Ailk_Bjlk_DB_MT64x32x16_MI16x16x4x1_SN_1LDSB0_AMAS0_DTVA0_GRVW1_NEPBS4_NLCA1_PLR1_SVW1_TT1_32_VW1_WG64_4_1_WGM6
    SolutionIndex: 133
    SolutionNameMin: Cijk_Ailk_Bjlk_DB_MT64x64x16_MI16x16x4x1_SN_1LDSB1_AMAS0_DTVA0_GRVW2_NEPBS0_NLCA1_PLR5_SVW1_TT2_32_VW1_WG32_8_1_WGM6
    SolutionIndex: 134
    SolutionNameMin: Cijk_Ailk_Bjlk_DB_MT64x64x16_MI16x16x4x1_SN_1LDSB0_AMAS3_DTVA0_GRVW2_NEPBS4_NLCA1_PLR1_SVW2_TT2_32_VW2_WG32_8_1_WGM6
    SolutionIndex: 135
    SolutionNameMin: Cijk_Ailk_Bjlk_DB_MT64x64x16_MI16x16x4x1_SN_AMAS3_DTVA0_GRVW1_NEPBS0_NLCA1_PLR5_SVW2_TT2_32_VW2_WG32_8_1_WGM6
    SolutionIndex: 136
    SolutionNameMin: Cijk_Ailk_Bjlk_DB_MT64x32x32_MI16x16x4x1_SN_AMAS0_DTVA1_GRVW1_NEPBS0_NLCA1_PLR9_SVW1_TT1_32_VW1_WG64_4_1_WGM6
    SolutionIndex: 137
    SolutionNameMin: Cijk_Ailk_Bjlk_DB_MT64x64x16_MI16x16x4x1_SN_AMAS3_DTVA0_GRVW1_NEPBS4_NLCA1_PLR5_SVW2_TT2_32_VW2_WG32_8_1_WGM6
    SolutionIndex: 138
    SolutionNameMin: Cijk_Ailk_Bjlk_DB_MT64x64x32_MI16x16x4x1_SN_AMAS0_DTVA1_GRVW1_NEPBS0_NLCA1_PLR9_SVW1_TT1_64_VW1_WG64_4_1_WGM6
    SolutionIndex: 139
    SolutionNameMin: Cijk_Ailk_Bjlk_DB_MT64x64x16_MI16x16x4x1_SN_AMAS3_DTVA0_GRVW1_NEPBS0_NLCA1_PLR5_SVW2_TT2_32_VW2_WG32_8_1_WGM12
    SolutionIndex: 140
    SolutionNameMin: Cijk_Ailk_Bjlk_DB_MT64x64x16_MI16x16x4x1_SN_AMAS3_DTVA0_GRVW2_NEPBS0_NLCA1_PLR5_SVW2_TT2_32_VW2_WG32_8_1_WGM6
    SolutionIndex: 141
    SolutionNameMin: Cijk_Ailk_Bjlk_DB_MT64x64x32_MI16x16x4x1_SN_AMAS0_DTVA0_GRVW2_NEPBS0_NLCA1_PLR9_SVW1_TT2_32_VW1_WG32_8_1_WGM12
    SolutionIndex: 142
    SolutionNameMin: Cijk_Ailk_Bjlk_DB_MT128x64x16_MI16x16x4x1_SN_AMAS3_DTVA1_GRVW2_NEPBS0_NLCA1_PLR5_SVW2_TT2_64_VW2_WG64_4_1_WGM6
    SolutionIndex: 143
    SolutionNameMin: Cijk_Ailk_Bjlk_DB_MT128x64x16_MI16x16x4x1_SN_AMAS3_DTVA1_GRVW2_NEPBS0_NLCA1_PLR1_SVW2_TT2_64_VW2_WG64_4_1_WGM6
    SolutionIndex: 144
    SolutionNameMin: Cijk_Ailk_Bjlk_DB_MT128x64x16_MI16x16x4x1_SN_AMAS3_DTVA1_GRVW2_NEPBS0_NLCA1_PLR1_SVW2_TT2_64_VW2_WG64_4_1_WGM12
    SolutionIndex: 145
    SolutionNameMin: Cijk_Ailk_Bjlk_DB_MT128x64x16_MI16x16x4x1_SN_AMAS0_DTVA0_GRVW2_NEPBS0_NLCA1_PLR5_SVW1_TT2_64_VW1_WG64_4_1_WGM12
    SolutionIndex: 146
    SolutionNameMin: Cijk_Ailk_Bjlk_DB_MT128x64x16_MI16x16x4x1_SN_AMAS0_DTVA0_GRVW2_NEPBS0_NLCA1_PLR5_SVW1_TT4_32_VW1_WG32_8_1_WGM12
    SolutionIndex: 147
    SolutionNameMin: Cijk_Ailk_Bjlk_DB_MT128x64x16_MI16x16x4x1_SN_AMAS3_DTVA1_GRVW2_NEPBS4_NLCA1_PLR5_SVW2_TT2_64_VW2_WG64_4_1_WGM12
    SolutionIndex: 148
    SolutionNameMin: Cijk_Ailk_Bjlk_DB_MT64x64x16_MI16x16x4x1_SN_AMAS3_DTVA0_GRVW2_NEPBS4_NLCA1_PLR5_SVW2_TT2_32_VW2_WG32_8_1_WGM6
    SolutionIndex: 149
    SolutionNameMin: Cijk_Ailk_Bjlk_DB_MT128x64x16_MI16x16x4x1_SN_AMAS3_DTVA0_GRVW2_NEPBS0_NLCA1_PLR5_SVW2_TT4_32_VW2_WG32_8_1_WGM12
    SolutionIndex: 150
    SolutionNameMin: Cijk_Ailk_Bjlk_DB_MT64x32x32_MI16x16x4x1_SN_AMAS0_DTVA0_GRVW2_NEPBS4_NLCA1_PLR9_SVW1_TT1_32_VW1_WG64_4_1_WGM6
- - - [6144, 4864, 1, 512]
    - [18, 89.473]
  - - [7296, 4096, 1, 4096]
    - [1, 98.145]
  - - [16384, 16384, 1, 4096]
    - [6, 98.831]
  - - [4864, 3072, 1, 4096]
    - [0, 97.233]
  - - [7296, 4608, 1, 4096]
    - [2, 98.269]
  - - [7296, 4608, 1, 8192]
    - [3, 98.833]
  - - [9728, 6144, 1, 4096]
    - [4, 98.646]
  - - [9728, 6144, 1, 8192]
    - [5, 99.036]
  - - [14592, 15360, 1, 512]
    - [12, 95.496]
  - - [19456, 18432, 1, 512]
    - [12, 95.934]
  - - [1030, 1030, 1, 1030]
    - [7, 37.314]
  - - [1032, 1032, 1, 1032]
    - [8, 37.805]
  - - [2046, 2046, 1, 2046]
    - [13, 66.603]
  - - [2048, 2048, 1, 2048]
    - [14, 69.186]
  - - [4094, 4094, 1, 2046]
    - [9, 90.85]
  - - [4096, 4096, 1, 2048]
    - [10, 92.994]
  - - [7296, 4864, 1, 4096]
    - [11, 97.45]
  - - [1031, 1031, 1, 1031]
    - [15, 33.905]
  - - [2047, 2047, 1, 2047]
    - [16, 63.331]
  - - [4095, 4095, 1, 2047]
    - [17, 81.582]
  - - [127488, 25088, 1, 512]
    - [19, 92.477]
  - - [127488, 25600, 1, 512]
    - [19, 92.396]
  - - [124416, 23552, 1, 512]
    - [19, 92.268]
  - - [124416, 24064, 1, 512]
    - [20, 91.971]
  - - [120832, 22016, 1, 512]
    - [21, 92.424]
  - - [120832, 21504, 1, 512]
    - [21, 92.858]
  - - [117760, 20480, 1, 512]
    - [19, 93.124]
  - - [117760, 19968, 1, 512]
    - [19, 93.158]
  - - [113664, 18432, 1, 512]
    - [19, 93.446]
  - - [113664, 17920, 1, 512]
    - [19, 93.26]
  - - [111104, 16896, 1, 512]
    - [21, 93.563]
  - - [111104, 17408, 1, 512]
    - [22, 93.124]
  - - [108032, 15360, 1, 512]
    - [19, 93.849]
  - - [108032, 15872, 1, 512]
    - [19, 93.808]
  - - [103936, 13312, 1, 512]
    - [19, 93.949]
  - - [103936, 13824, 1, 512]
    - [19, 94.126]
  - - [100352, 11776, 1, 512]
    - [20, 94.006]
  - - [100352, 11264, 1, 512]
    - [19, 94.248]
  - - [97280, 10240, 1, 512]
    - [22, 94.191]
  - - [97280, 9728, 1, 512]
    - [22, 94.145]
  - - [93696, 8192, 1, 512]
    - [20, 94.428]
  - - [93696, 8704, 1, 512]
    - [19, 94.434]
  - - [90112, 6656, 1, 512]
    - [19, 94.458]
  - - [90112, 6144, 1, 512]
    - [19, 94.446]
  - - [87040, 5120, 1, 512]
    - [20, 94.443]
  - - [87040, 4608, 1, 512]
    - [21, 94.411]
  - - [85504, 4096, 1, 512]
    - [19, 93.828]
  - - [85504, 4608, 1, 512]
    - [21, 94.624]
  - - [82944, 3072, 1, 512]
    - [21, 94.199]
  - - [82944, 2560, 1, 512]
    - [19, 91.817]
  - - [81920, 2560, 1, 512]
    - [19, 91.543]
  - - [81920, 2048, 1, 512]
    - [23, 86.502]
  - - [80384, 1536, 1, 512]
    - [24, 90.663]
  - - [80384, 2048, 1, 512]
    - [23, 86.351]
  - - [78336, 1024, 1, 512]
    - [25, 75.216]
  - - [74240, 37376, 1, 512]
    - [19, 94.471]
  - - [74240, 36864, 1, 512]
    - [19, 94.758]
  - - [70144, 35328, 1, 512]
    - [21, 94.971]
  - - [70144, 34816, 1, 512]
    - [19, 94.944]
  - - [66048, 33280, 1, 512]
    - [22, 94.99]
  - - [66048, 32768, 1, 512]
    - [20, 94.96]
  - - [61952, 31232, 1, 512]
    - [21, 95.123]
  - - [61952, 30720, 1, 512]
    - [21, 95.28]
  - - [59904, 30208, 1, 512]
    - [20, 95.226]
  - - [59904, 29696, 1, 512]
    - [19, 95.335]
  - - [56832, 28672, 1, 512]
    - [22, 95.209]
  - - [56832, 28160, 1, 512]
    - [19, 94.946]
  - - [54784, 27648, 1, 512]
    - [19, 95.47]
  - - [54784, 27136, 1, 512]
    - [21, 95.395]
  - - [52736, 26624, 1, 512]
    - [24, 95.386]
  - - [52736, 26112, 1, 512]
    - [21, 95.492]
  - - [49664, 25088, 1, 512]
    - [22, 95.494]
  - - [49664, 24576, 1, 512]
    - [21, 95.573]
  - - [47616, 24064, 1, 512]
    - [20, 95.491]
  - - [47616, 23552, 1, 512]
    - [20, 95.428]
  - - [44544, 22528, 1, 512]
    - [19, 95.363]
  - - [44544, 22016, 1, 512]
    - [22, 95.439]
  - - [41472, 20992, 1, 512]
    - [26, 95.557]
  - - [41472, 20480, 1, 512]
    - [26, 95.518]
  - - [39424, 19968, 1, 512]
    - [21, 95.554]
  - - [39424, 19456, 1, 512]
    - [22, 95.251]
  - - [37376, 18944, 1, 512]
    - [26, 94.787]
  - - [37376, 18432, 1, 512]
    - [22, 95.56]
  - - [34304, 17408, 1, 512]
    - [20, 95.25]
  - - [34304, 16896, 1, 512]
    - [26, 95.316]
  - - [32256, 16384, 1, 512]
    - [26, 94.948]
  - - [32256, 15872, 1, 512]
    - [19, 94.899]
  - - [29184, 14848, 1, 512]
    - [20, 94.636]
  - - [29184, 14336, 1, 512]
    - [20, 94.716]
  - - [27136, 13824, 1, 512]
    - [26, 95.025]
  - - [27136, 13312, 1, 512]
    - [19, 94.326]
  - - [24064, 12288, 1, 512]
    - [26, 94.442]
  - - [24064, 11776, 1, 512]
    - [22, 94.388]
  - - [22016, 11264, 1, 512]
    - [20, 92.765]
  - - [22016, 10752, 1, 512]
    - [22, 94.172]
  - - [19968, 10240, 1, 512]
    - [21, 91.052]
  - - [19968, 9728, 1, 512]
    - [26, 93.025]
  - - [17920, 9216, 1, 512]
    - [26, 93.175]
  - - [17920, 8704, 1, 512]
    - [22, 90.02]
  - - [14848, 7680, 1, 512]
    - [22, 92.661]
  - - [14848, 7168, 1, 512]
    - [19, 90.756]
  - - [12800, 6656, 1, 512]
    - [27, 90.185]
  - - [12800, 6144, 1, 512]
    - [27, 89.354]
  - - [11264, 5632, 1, 512]
    - [26, 86.426]
  - - [10752, 5632, 1, 512]
    - [26, 82.419]
  - - [10752, 5120, 1, 512]
    - [26, 87.64]
  - - [11264, 5120, 1, 512]
    - [26, 86.754]
  - - [10240, 5120, 1, 512]
    - [26, 83.729]
  - - [9728, 5120, 1, 512]
    - [26, 85.094]
  - - [9728, 4608, 1, 512]
    - [26, 90.893]
  - - [10240, 4608, 1, 512]
    - [26, 89.356]
  - - [8704, 4608, 1, 512]
    - [26, 88.465]
  - - [8704, 4096, 1, 512]
    - [22, 84.977]
  - - [7680, 4096, 1, 512]
    - [22, 83.671]
  - - [7680, 3584, 1, 512]
    - [20, 78.979]
  - - [6656, 3584, 1, 512]
    - [81, 81.817]
  - - [6656, 3072, 1, 512]
    - [27, 80.971]
  - - [5632, 3072, 1, 512]
    - [24, 80.623]
  - - [5632, 2560, 1, 512]
    - [80, 79.455]
  - - [4608, 2560, 1, 512]
    - [85, 70.899]
  - - [4608, 2048, 1, 512]
    - [92, 68.698]
  - - [3584, 2048, 1, 512]
    - [98, 71.639]
  - - [3584, 1536, 1, 512]
    - [99, 68.364]
  - - [2560, 1536, 1, 512]
    - [104, 57.434]
  - - [2560, 1024, 1, 512]
    - [106, 54.551]
  - - [127488, 25089, 1, 512]
    - [28, 86.466]
  - - [124416, 23553, 1, 512]
    - [29, 86.986]
  - - [120832, 21505, 1, 512]
    - [28, 87.849]
  - - [117760, 19969, 1, 512]
    - [30, 87.911]
  - - [113664, 17921, 1, 512]
    - [31, 88.149]
  - - [111104, 16897, 1, 512]
    - [30, 88.291]
  - - [108032, 15361, 1, 512]
    - [32, 88.99]
  - - [103936, 13313, 1, 512]
    - [31, 88.432]
  - - [100352, 11265, 1, 512]
    - [33, 86.826]
  - - [97280, 9729, 1, 512]
    - [29, 87.073]
  - - [93696, 8193, 1, 512]
    - [32, 85.999]
  - - [90112, 6145, 1, 512]
    - [28, 88.397]
  - - [87040, 4609, 1, 512]
    - [31, 87.862]
  - - [85504, 4097, 1, 512]
    - [34, 86.603]
  - - [82944, 2561, 1, 512]
    - [35, 83.941]
  - - [81920, 2049, 1, 512]
    - [33, 74.948]
  - - [80384, 1537, 1, 512]
    - [30, 80.469]
  - - [78336, 513, 1, 512]
    - [36, 57.873]
  - - [74240, 36865, 1, 512]
    - [37, 90.192]
  - - [70144, 34817, 1, 512]
    - [38, 90.641]
  - - [66048, 32769, 1, 512]
    - [37, 90.243]
  - - [61952, 30721, 1, 512]
    - [39, 91.187]
  - - [59904, 29697, 1, 512]
    - [40, 90.232]
  - - [56832, 28161, 1, 512]
    - [37, 90.584]
  - - [54784, 27137, 1, 512]
    - [41, 91.339]
  - - [52736, 26113, 1, 512]
    - [40, 91.311]
  - - [49664, 24577, 1, 512]
    - [39, 91.661]
  - - [47616, 23553, 1, 512]
    - [37, 90.622]
  - - [44544, 22017, 1, 512]
    - [39, 90.538]
  - - [41472, 20481, 1, 512]
    - [40, 90.231]
  - - [39424, 19457, 1, 512]
    - [41, 91.584]
  - - [37376, 18433, 1, 512]
    - [42, 91.74]
  - - [34304, 16897, 1, 512]
    - [43, 91.775]
  - - [32256, 15873, 1, 512]
    - [44, 90.206]
  - - [29184, 14337, 1, 512]
    - [37, 89.629]
  - - [27136, 13313, 1, 512]
    - [44, 90.552]
  - - [24064, 11777, 1, 512]
    - [41, 90.694]
  - - [22016, 10753, 1, 512]
    - [43, 90.717]
  - - [19968, 9729, 1, 512]
    - [39, 88.378]
  - - [17920, 8705, 1, 512]
    - [45, 88.713]
  - - [14848, 7169, 1, 512]
    - [46, 89.159]
  - - [12800, 6145, 1, 512]
    - [47, 87.547]
  - - [11264, 5121, 1, 512]
    - [78, 86.734]
  - - [10752, 5121, 1, 512]
    - [42, 81.661]
  - - [10240, 4609, 1, 512]
    - [80, 87.71]
  - - [9728, 4609, 1, 512]
    - [48, 83.021]
  - - [8704, 4097, 1, 512]
    - [49, 83.525]
  - - [7680, 3585, 1, 512]
    - [47, 77.408]
  - - [6656, 3073, 1, 512]
    - [47, 78.224]
  - - [5632, 2561, 1, 512]
    - [86, 68.8]
  - - [4608, 2049, 1, 512]
    - [85, 67.73]
  - - [3584, 1537, 1, 512]
    - [97, 56.94]
  - - [2560, 1025, 1, 512]
    - [94, 54.281]
  - - [127488, 512, 1, 512]
    - [50, 73.063]
  - - [124416, 512, 1, 512]
    - [51, 73.372]
  - - [120832, 512, 1, 512]
    - [51, 74.148]
  - - [117760, 512, 1, 512]
    - [52, 73.928]
  - - [113664, 512, 1, 512]
    - [53, 74.039]
  - - [111104, 512, 1, 512]
    - [51, 72.895]
  - - [108032, 512, 1, 512]
    - [54, 74.307]
  - - [103936, 512, 1, 512]
    - [54, 73.018]
  - - [100352, 512, 1, 512]
    - [55, 73.597]
  - - [97280, 512, 1, 512]
    - [54, 72.361]
  - - [93696, 512, 1, 512]
    - [56, 73.569]
  - - [90112, 512, 1, 512]
    - [57, 71.988]
  - - [87040, 512, 1, 512]
    - [54, 74.433]
  - - [85504, 512, 1, 512]
    - [58, 73.427]
  - - [82944, 512, 1, 512]
    - [59, 71.821]
  - - [81920, 512, 1, 512]
    - [51, 71.81]
  - - [80384, 512, 1, 512]
    - [54, 72.622]
  - - [74240, 512, 1, 512]
    - [55, 70.992]
  - - [70144, 512, 1, 512]
    - [57, 72.971]
  - - [66048, 512, 1, 512]
    - [60, 69.553]
  - - [61952, 512, 1, 512]
    - [60, 71.771]
  - - [59904, 512, 1, 512]
    - [61, 69.488]
  - - [56832, 512, 1, 512]
    - [62, 73.159]
  - - [54784, 512, 1, 512]
    - [60, 70.59]
  - - [52736, 512, 1, 512]
    - [63, 68.36]
  - - [49664, 512, 1, 512]
    - [56, 71.811]
  - - [47616, 512, 1, 512]
    - [64, 69.141]
  - - [44544, 512, 1, 512]
    - [65, 65.404]
  - - [41472, 512, 1, 512]
    - [66, 69.598]
  - - [39424, 512, 1, 512]
    - [61, 66.148]
  - - [37376, 512, 1, 512]
    - [61, 63.311]
  - - [34304, 512, 1, 512]
    - [56, 68.013]
  - - [32256, 512, 1, 512]
    - [60, 64.396]
  - - [29184, 512, 1, 512]
    - [67, 68.835]
  - - [27136, 512, 1, 512]
    - [68, 67.085]
  - - [24064, 512, 1, 512]
    - [69, 60.191]
  - - [22016, 512, 1, 512]
    - [69, 55.892]
  - - [19968, 512, 1, 512]
    - [70, 68.43]
  - - [17920, 512, 1, 512]
    - [71, 59.478]
  - - [14848, 512, 1, 512]
    - [72, 51.167]
  - - [12800, 512, 1, 512]
    - [66, 65.527]
  - - [11264, 512, 1, 512]
    - [77, 59.301]
  - - [10752, 512, 1, 512]
    - [73, 63.741]
  - - [10240, 512, 1, 512]
    - [79, 53.98]
  - - [9728, 512, 1, 512]
    - [74, 53.429]
  - - [8704, 512, 1, 512]
    - [74, 52.428]
  - - [7680, 512, 1, 512]
    - [75, 51.641]
  - - [6656, 512, 1, 512]
    - [82, 56.331]
  - - [5632, 512, 1, 512]
    - [87, 50.165]
  - - [4608, 512, 1, 512]
    - [91, 50.055]
  - - [3584, 512, 1, 512]
    - [76, 52.749]
  - - [2560, 512, 1, 512]
    - [105, 42.138]
  - - [6144, 3072, 1, 512]
    - [83, 80.937]
  - - [6144, 512, 1, 512]
    - [84, 55.244]
  - - [6144, 2561, 1, 512]
    - [85, 76.609]
  - - [6144, 2560, 1, 512]
    - [85, 77.271]
  - - [5120, 2560, 1, 512]
    - [86, 73.715]
  - - [5120, 512, 1, 512]
    - [88, 51.651]
  - - [5120, 2049, 1, 512]
    - [89, 70.654]
  - - [5120, 2048, 1, 512]
    - [90, 72.638]
  - - [4096, 2048, 1, 512]
    - [93, 62.01]
  - - [4096, 512, 1, 512]
    - [94, 46.043]
  - - [4096, 1537, 1, 512]
    - [95, 63.187]
  - - [4096, 1536, 1, 512]
    - [96, 64.106]
  - - [3072, 1536, 1, 512]
    - [100, 62.489]
  - - [3072, 512, 1, 512]
    - [101, 46.926]
  - - [3072, 1025, 1, 512]
    - [102, 57.311]
  - - [3072, 1024, 1, 512]
    - [103, 59.346]
  - - [2048, 1024, 1, 512]
    - [107, 45.535]
  - - [2048, 1025, 1, 512]
    - [108, 45.113]
  - - [2048, 512, 1, 512]
    - [109, 33.744]
  - - [2048, 513, 1, 512]
    - [109, 34.732]
  - - [1536, 513, 1, 512]
    - [110, 33.056]
  - - [1536, 1024, 1, 512]
    - [111, 46.97]
  - - [1536, 512, 1, 512]
    - [112, 32.178]
  - - [1024, 513, 1, 512]
    - [113, 21.979]
  - - [1024, 512, 1, 512]
    - [114, 21.734]
  - - [512, 512, 1, 512]
    - [115, 9.951]
  - - [77824, 1, 1, 512]
    - [116, 0.854]
  - - [76800, 1, 1, 512]
    - [117, 0.839]
  - - [512, 1, 1, 512]
    - [118, 0.041]
  - - [64, 1, 1000, 64]
    - [119, 0.46]
  - - [1, 64, 1000, 64]
    - [120, 0.381]
  - - [31, 31, 1000, 31]
    - [121, 3.216]
  - - [33, 33, 1000, 33]
    - [122, 3.076]
  - - [47, 47, 1000, 47]
    - [123, 5.829]
  - - [49, 49, 1000, 49]
    - [124, 5.736]
  - - [63, 63, 128, 63]
    - [125, 4.863]
  - - [65, 65, 128, 65]
    - [126, 3.729]
  - - [79, 79, 128, 79]
    - [127, 5.394]
  - - [81, 81, 128, 81]
    - [128, 5.529]
  - - [95, 95, 64, 95]
    - [129, 6.311]
  - - [97, 97, 64, 97]
    - [130, 6.644]
  - - [127, 127, 64, 127]
    - [131, 11.794]
  - - [129, 129, 64, 129]
    - [126, 8.488]
  - - [255, 255, 16, 255]
    - [130, 17.479]
  - - [257, 257, 16, 257]
    - [132, 15.304]
  - - [511, 511, 16, 511]
    - [133, 34.883]
  - - [513, 513, 16, 513]
    - [134, 36.84]
  - - [30, 30, 1000, 30]
    - [135, 3.232]
  - - [32, 32, 1000, 32]
    - [136, 3.985]
  - - [34, 34, 1000, 34]
    - [135, 3.744]
  - - [46, 46, 1000, 46]
    - [137, 6.175]
  - - [48, 48, 1000, 48]
    - [138, 7.587]
  - - [50, 50, 1000, 50]
    - [139, 6.905]
  - - [62, 62, 128, 62]
    - [140, 4.953]
  - - [64, 64, 128, 64]
    - [141, 5.967]
  - - [66, 66, 128, 66]
    - [142, 4.178]
  - - [78, 78, 128, 78]
    - [143, 6.048]
  - - [80, 80, 128, 80]
    - [144, 7.013]
  - - [82, 82, 128, 82]
    - [144, 6.702]
  - - [94, 94, 64, 94]
    - [144, 6.8]
  - - [96, 96, 64, 96]
    - [145, 8.103]
  - - [98, 98, 64, 98]
    - [146, 7.296]
  - - [126, 126, 64, 126]
    - [147, 12.768]
  - - [128, 128, 64, 128]
    - [144, 14.439]
  - - [130, 130, 64, 130]
    - [148, 8.847]
  - - [254, 254, 16, 254]
    - [149, 19.004]
  - - [256, 256, 16, 256]
    - [144, 21.907]
  - - [258, 258, 16, 258]
    - [150, 15.056]
  - - [510, 510, 16, 510]
    - [137, 36.552]
  - - [514, 514, 16, 514]
    - [148, 37.304]
- null
